SR NO,WORD,MEANING,BREIF,VERB,NOUN,ADJECTIVE,DETERMINER,ADVERB,PRONOUN,PERPOSITION,CONJUNCTION,INTERJECTION
156,eminent,standing above others in quality or position,"Anyone highly regarded or prominent is eminent. Eminent people are very successful at their jobs. If you’ve heard of Neil deGrasse Tyson, it’s probably because he’s an eminent astrophysicist.",,,of imposing height; especially standing out above others,,,,,,,
,,,,,,standing above others in quality or position,,,,,,,
,,,,,,(used of persons) standing above others in character or attainment or reputation,,,,,,,
,,,,,,having an illustrious reputation; respected,,,,,,,
157,ambiguity,unclearness by virtue of having more than one meaning,"Something with ambiguity is unclear. Think about the sentence, ""Jill saw the man with binoculars."" If you are wondering whether Jill or the man had the binoculars, you are noticing the ambiguity, or the double meaning, of this sentence.",,an expression whose meaning cannot be determined from its context,,,,,,,,
,,,,,unclearness by virtue of having more than one meaning,,,,,,,,
158,aberration,a state or condition markedly different from the norm,"An aberration is something strange that rarely occurs. An example of an aberration is when the temperature in Minnesota hits 90 degrees in January — it's nice and warm, but it's really strange.",,an optical phenomenon resulting from the failure of a lens or mirror to produce a good image,,,,,,,,
,,,,,a state or condition markedly different from the norm,,,,,,,,
,,,,,a disorder in one's mental state,,,,,,,,
159,complaisance,a tendency to try to please or yield to the will of others,Complaisance is a quality of being eager to please or happy to follow instructions. Your new puppy's complaisance is going to make her easy to train.,,a disposition or tendency to yield to the will of others,,,,,,,,
160,obstinate,marked by tenacious unwillingness to yield,"When someone is beyond stubborn, use the word obstinate instead: ""You obstinate old mule! Get out of my way!""",persist stubbornly,,resistant to guidance or discipline,,,,,,,
161,shrewdness,intelligence manifested by being astute,,,intelligence manifested by being astute (as in business dealings),,,,,,,,
162,erudite,having or showing profound knowledge,"If you call someone erudite, that means they show great learning. After you've earned your second Ph.D., you will be truly erudite.",,,having or showing profound knowledge,,,,,,,
163,culminate,"end, especially to reach a final or climactic stage","The verb culminate is used to describe a high point or a climactic stage in a process. For example, the goal of a Major League baseball team is to have their season culminate in a World Series victory.","rise to, or form, a summit",,,,,,,,,
,,,,"end, especially to reach a final or climactic stage",,,,,,,,,
,,,,bring to a head or to the highest point,,,,,,,,,
,,,,reach the highest or most decisive point,,,,,,,,,
164,acquiesce,agree or express agreement,"To acquiesce is to agree to something or to give in. If your kid sister is refusing to hand over the television remote, you hope she acquiesces before your favorite show comes on.",agree or express agreement,,,,,,,,,
165,diffidence,lack of self-assurance,"The noun diffidence refers to a lack of self-confidence. Your diffidence might be the reason why you never say ""hi"" to the cute guy or gal in the elevator or why you never ask for a raise.",,lack of self-confidence,,,,,,,,
166,disabuse,free somebody from an erroneous belief,"Disabuse means to free someone of a belief that is not true. Many teachers of health find that when they teach, they spend as much energy disabusing kids of false beliefs as they do giving them the facts.",free somebody (from an erroneous belief),,,,,,,,,
167,frivolous,"not serious in content, attitude, or behavior","Frivolous things are silly or unnecessary. If something is frivolous, then you don't need it.",,,not serious in content or attitude or behavior,,,,,,,
168,vacillate,be undecided about something,"Vacillate means to waver back and forth, unable to decide. You might vacillate between ordering waffles and pancakes at your favorite diner — it’s hard to pick just one when both are so tasty!",move or sway in a rising and falling or wavelike pattern,,,,,,,,,
,,,,be undecided about something; waver between conflicting positions or courses of action,,,,,,,,,
169,propriety,correct behavior,Propriety is following what is socially acceptable in speech and behavior. Your little brother might offend your sense of propriety by burping loudly at the dinner table.,,correct or appropriate behavior,,,,,,,,
170,lugubrious,excessively mournful,"Funerals are lugubrious. So are rainy days and Mondays. Anything that makes you sad, gloomy, or mournful can be called lugubrious.",,,excessively mournful,,,,,,,
171,persistent,stubbornly unyielding,"If something is persistent, it just won't stop. If you're persistent in your suggestions for a trip to Mexico, maybe your parents will eventually give in and take you there.",,,retained; not shed,,,,,,,
,,,,,,stubbornly unyielding,,,,,,,
,,,,,,never-ceasing,,,,,,,
,,,,,,continually recurring to the mind,,,,,,,
172,implacable,incapable of being appeased or pacified,"An implacable person just can’t be appeased. If you really offended your best friend and tried every kind of apology but she refused to speak to you again, you could describe her as implacable.",,,incapable of being placated,,,,,,,
173,obdurate,stubbornly persistent in wrongdoing,"Obdurate is a formal word meaning stubborn. If you want to major in English, but your parents are obdurate that you should go premed, they might go so far as to threaten not to pay your tuition.",,,showing unfeeling resistance to tender feelings,,,,,,,
,,,,,,stubbornly persistent in wrongdoing,,,,,,,
174,abstain,"refrain from doing, consuming, or partaking in something","If you abstain from something, you restrain yourself from consuming it. People usually abstain from things that are considered vices — like eating French fries every day for lunch.",refrain from voting,,,,,,,,,
,,,,choose not to partake in or consume,,,,,,,,,
175,impetuous,characterized by undue haste and lack of thought,"Someone impetuous acts too hastily or carelessly. Hotheaded, impulsive folks are impetuous.",,,marked by violent force,,,,,,,
,,,,,,characterized by undue haste and lack of thought or deliberation,,,,,,,
176,decorum,propriety in manners and conduct,"Decorum is proper and polite behavior. If you let out a big belch at a fancy dinner party, you're not showing much decorum.",,the fitness of a composition’s style to its subject,,,,,,,,
,,,,,propriety in manners and conduct,,,,,,,,
177,eloquent,"expressing yourself readily, clearly, effectively","When you're eloquent, you have a way with words. An eloquent speaker expresses herself clearly and powerfully. Even though eloquent usually describes oral speech, it can also be used to describe powerful writing.",,,"expressing yourself readily, clearly, effectively",,,,,,,
178,providential,peculiarly fortunate or appropriate,"If your best friend pulls up beside you in her convertible just as your bike gets a flat tire, you could call it providential, or magically lucky.",,,resulting from divine providence,,,,,,,
,,,,,,peculiarly fortunate or appropriate; as if by divine intervention,,,,,,,
,,,,,,relating to or characteristic of providence,,,,,,,
179,prodigious,"great in size, force, extent, or degree","Something exceptional, substantial, or great is prodigious. A blizzard includes prodigious wind and snow. A prodigious writer is one who can write a lot and do it well.",,,of momentous or ominous significance,,,,,,,
,,,,,,so great in size or force or extent as to elicit awe,,,,,,,
,,,,,,far beyond what is usual in magnitude or degree,,,,,,,
180,zeal,a feeling of strong eagerness,"Zeal is dedication or enthusiasm for something. If you have zeal, you're willing, energized, and motivated.",,excessive fervor to do something or accomplish some end,,,,,,,,
,,,,,a feeling of strong eagerness (usually in favor of a person or cause),,,,,,,,
,,,,,prompt willingness,,,,,,,,
181,puerile,displaying or suggesting a lack of maturity,"Some people like their movies to have sophisticated humor and others prefer the more puerile humor of pratfalls or jokes about smelly underwear, inappropriate belching, and passing gas.",,,of or characteristic of a child,,,,,,,
,,,,,,displaying or suggesting a lack of maturity,,,,,,,
182,obfuscate,make obscure or unclear,"Some people are experts at obfuscating the truth by being evasive, unclear, or obscure in the telling of the facts. The people who are good at obfuscating would include defense lawyers and teenagers asked about their plans for Saturday night.",make obscure or unclear,,,,,,,,,
183,apathy,an absence of emotion or enthusiasm,Use the noun apathy when someone isn't interested in the important things that are happening. You might feel apathy for the political process after watching candidates bicker tediously with one another.,,the trait of lacking enthusiasm for or interest in things generally,,,,,,,,
,,,,,an absence of emotion or enthusiasm,,,,,,,,
184,benevolent,showing or motivated by sympathy and understanding,"Choose the adjective benevolent for someone who does good deeds or shows goodwill. If your teacher collects homework with a benevolent smile, she's hoping that you've done a good job.",,,generous in assistance to the poor,,,,,,,
,,,,,,showing or motivated by sympathy and understanding and generosity,,,,,,,
,,,,,,intending or showing kindness,,,,,,,
,,,,,,generous in providing aid to others,,,,,,,
185,predicament,an unpleasant or difficult situation,"If you're engaged to get married but suddenly fall in love with someone else, you have gotten yourself into quite a predicament. A predicament is a difficult, confusing, and unpleasant situation.",,a situation from which extrication is difficult especially an unpleasant or trying one,,,,,,,,
186,confine,place limits on,"Confine is all about setting limits. If you are confined to the house, it means you can't leave it. If you're really sick, you might be confined to your bed.","close in; ""darkness confined him""",,,,,,,,,
,,,,place limits on (extent or access),,,,,,,,,
,,,,"restrict or confine, ""I limit you to two visits to the pub a day""",,,,,,,,,
,,,,deprive of freedom; take into confinement,,,,,,,,,
187,progeny,the immediate descendants of a person,"Progeny means ""offspring"" or ""children."" You and your brothers are the progeny of your parents, and your cat's new litter of kittens is her progeny.",,the immediate descendants of a person,,,,,,,,
188,repertoire,the range of skills in a particular field or occupation,Repertoire refers to the full supply of what you can do. A singer's repertoire is all the songs he can sing. A chef's repertoire is what she knows how to cook.,,"a collection of works (plays, songs, operas, ballets) that an artist or company can perform and do perform for short intervals on a regular schedule",,,,,,,,
,,,,,the entire range of skills or aptitudes or devices used in a particular field or occupation,,,,,,,,
189,impelled,urged or forced to action through moral pressure,,,,urged or forced to action through moral pressure,,,,,,,
190,etched,cut or impressed into a surface,,,,cut or impressed into a surface,,,,,,,
191,prowl,move about in or as if in a predatory manner,"If you move stealthily — like you're looking for something to prey on — then you prowl. Your cat might prowl around the room and pounce on your feet, which is cute if you're awake, but annoying when you're asleep.","loiter about, with no apparent aim",the act of prowling (walking about in a stealthy manner),,,,,,,,
192,propensity,a natural inclination,"A propensity is a natural tendency to behave in a certain way. We all have propensities — things we tend to do. Dogs have a propensity to bark, and many people have a propensity for getting annoyed by it.",,a disposition to behave in a certain way,,,,,,,,
,,,,,a natural inclination,,,,,,,,
,,,,,an inclination to do something,,,,,,,,
193,comprehend,get the meaning of something,"To comprehend something is to understand it, like when you have to read a difficult passage more than once in order to comprehend it.",include in scope; include as part of something broader; have as one's sphere or territory,,,,,,,,,
,,,,get the meaning of something,,,,,,,,,
,,,,become aware of through the senses,,,,,,,,,
194,thoroughly,in an exhaustive manner,"Thoroughly means exhaustively and completely. No matter how thoroughly you clean every carpet, shelf, and windowpane in a house, there is always more dust to be found.",,,,,completely and absolutely (`good' is sometimes used informally for `thoroughly'),,,,,
,,,,,,,,in an exhaustive manner,,,,,
195,erroneous,containing or characterized by mistakes,The adjective erroneous describes something or someone as mistaken and incorrect. Early explorers had the erroneous notion that the oceans were full of dragons.,,,containing or characterized by error,,,,,,,
196,espouse,"choose and follow a theory, idea, policy, etc.","Use the verb espouse to describe the actions of someone who lives according to specific beliefs, such as your friends who espouse environmentalism and as a result walk whenever possible instead of taking the car.",take in marriage,,,,,,,,,
,,,,"choose and follow; as of theories, ideas, policies, strategies or plans",,,,,,,,,
,,,,"take up the cause, ideology, practice, method, of someone and use it as one's own",,,,,,,,,
197,fallacious,containing or based on incorrect reasoning,"Something fallacious is a mistake that comes from too little information or unsound sources. Predictions that the whole state of California will snap off from the rest of North America and float away have proven to be fallacious — for now, anyway.",,,intended to deceive,,,,,,,
,,,,,,containing or based on a fallacy,,,,,,,
,,,,,,based on an incorrect or misleading notion or information,,,,,,,
198,decisive,characterized by resoluteness and firmness,"If you make decisions quickly, you are someone who is decisive. A decisive event can settle something, like a war.",,,unmistakable,,,,,,,
,,,,,,characterized by decision and firmness,,,,,,,
,,,,,,determining or having the power to determine an outcome,,,,,,,
,,,,,,forming or having the nature of a turning point or crisis,,,,,,,
199,penning,the act of creating written works,,,the act of creating written works,,,,,,,,
200,automation,the act of implementing the control of equipment,"Automation means making something automatic, or mechanized. If there's smoke in your house and your smoke detector is set up to ""call"" the fire department, that's an example of automation.",,the condition of being automatically operated or controlled,,,,,,,,
,,,,,the act of implementing the control of equipment with advanced technology; usually involving electronic hardware,,,,,,,,
,,,,,equipment used to achieve automatic control or operation,,,,,,,,
201,apprehended,fully understood or grasped,,,,fully understood or grasped,,,,,,,
202,manoeuvre,a military training exercise,,direct the course; determine the direction of travelling,an action aimed at evading an opponent,,,,,,,,
,,,,act in order to achieve a certain goal,a military training exercise,,,,,,,,
,,,,perform a movement in military or naval tactics in order to secure an advantage in attack or defense,a plan for attaining a particular goal,,,,,,,,
203,worthwhile,sufficiently valuable to justify the investment of time,Things that are worthwhile are good — they're worth the time or money you spend on them.,,,sufficiently valuable to justify the investment of time or interest,,,,,,,
204,wittingly,with full knowledge and deliberation,,,,,,with full knowledge and deliberation,,,,,
205,prominent,conspicuous in position or importance,"If you're looking for an adjective that means ""sticking out above the rest; famous,"" consider prominent. A prominent person might be the big star, the head honcho, the top dog — not just any ordinary person.",,,having a quality that thrusts itself into attention,,,,,,,
,,,,,,conspicuous in position or importance,,,,,,,
206,catapult,an engine providing medieval artillery used during sieges,"A catapult is something that hurls things through the air, like a catapult that sends pumpkins flying in an annual Halloween competition.",hurl as if with a sling,a plaything consisting of a Y-shaped stick with elastic between the arms; used to propel small stones,,,,,,,,
,,,,"shoot forth or launch, as if from a catapult",an engine that provided medieval artillery used during sieges; a heavy war engine for hurling large stones and other missiles,,,,,,,,
207,besieged,surrounded by hostile forces,,,,surrounded by hostile forces,,,,,,,
208,conviction,an unshakable belief in something without need for proof,A conviction is something certain: a judgment of guilty in court and a strong belief are both convictions.,,(criminal law) a final judgment of guilty in a criminal case and the punishment that is imposed,,,,,,,,
,,,,,an unshakable belief in something without need for proof or evidence,,,,,,,,
209,compelling,capable of arousing and holding the attention,"Compelling means attractive, or irresistible, or really, really convincing. You know your argument for backpacking across Europe is compelling when your parents not only let you go but also pay for all your expenses.",,,driving or forcing,,,,,,,
,,,,,,capable of arousing and holding the attention,,,,,,,
,,,,,,tending to persuade by forcefulness of argument,,,,,,,
210,elucidate,make clear and comprehensible,"If you elucidate something, you explain it very clearly. If you don't understand fractions, a visit to the pie shop may elucidate the subject for you.",make free from confusion or ambiguity; make clear,,,,,,,,,
,,,,make clear and (more) comprehensible,,,,,,,,,
211,rein,one of a pair of long straps used to control a horse,"Rein is both a noun and a verb for guiding and restraining. You can use the long strap, or rein, on a horse to control its speed and direction, and you can rein in your own tongue by closing your mouth.",stop or slow up one's horse or oneself by or as if by pulling the reins,any means of control,,,,,,,,
,,,,control and direct with or as if by reins,one of a pair of long straps (usually connected to the bit or the headpiece) used to control a horse,,,,,,,,
,,,,stop or check by or as if by a pull at the reins,one of a pair of long straps (usually connected to the bit or the headpiece) used to control a horse,,,,,,,,
,,,,keep in check,one of a pair of long straps (usually connected to the bit or the headpiece) used to control a horse,,,,,,,,
212,incessant,uninterrupted in time and indefinitely long continuing,"Something incessant continues without interruption. When you're on a cross-country flight, it's tough to tolerate the incessant crying of a baby.",,,uninterrupted in time and indefinitely long continuing,,,,,,,
213,falter,"move hesitatingly, as if about to give way","Falter means to hesitate, stumble, or waver, and everything from faith to voices can do it. So if you want to keep your bride or groom happy, it's best not to falter when it's your turn to say ""I do.""",be unsure or weak,the act of pausing uncertainly,,,,,,,,
214,etch,carve or cut a design or letters into,"If you etch something you are cutting into it. You can etch ""I ♥ U"" into a tree trunk with a pocket knife or etch your initials in your desk with a key (if the teacher's not looking).",cause to stand out or be clearly defined or visible,,,,,,,,,
,,,,carve or cut a design or letters into,,,,,,,,,
,,,,carve or cut into a block used for printing or print from such a block,,,,,,,,,
,,,,"selectively dissolve the surface of (a semiconductor or printed circuit) with a solvent, laser, or stream of electrons",,,,,,,,,
215,immemorial,long past,"Anything immemorial is very, very old. You're most likely to hear this word in the phrase ""time immemorial,"" a common way to say ""so long ago that no one remembers it.""",,,long past; beyond the limits of memory or tradition or recorded history,,,,,,,
216,delve,"turn up, loosen, or remove earth","The verb delve means to dig into, loosen, or investigate. She delved into her family's history and discovered an inventor, a checkers champion, and a circus equestrian in her ancestry.",consider in detail and subject to an analysis in order to discover essential features or meaning,,,,,,,,,
,,,,"turn up, loosen, or remove earth",,,,,,,,,
,,,,search for something in a receptacle or container,,,,,,,,,
,,,,inquire into,,,,,,,,,
217,bode,indicate by signs,"The verb bode suggests forecasting. Something bodes well when the clues or signs imply a favorable outcome. But if something bodes ill, you’d better watch out!",indicate by signs,,,,,,,,,
218,repose,freedom from activity,"Repose is a formal or literary term used to mean the act of resting, or the state of being at rest. Repose is also a state of mind: freedom from worry.",be inherent or innate in,a disposition free from stress or emotion,,,,,,,,
,,,,lean in a comfortable resting position,freedom from activity (work or strain or responsibility),,,,,,,,
,,,,lie when dead,the absence of mental stress or anxiety,,,,,,,,
,,,,put in a horizontal position,the absence of mental stress or anxiety,,,,,,,,
219,unscrupulous,without principles,Use the adjective unscrupulous to describe someone who behaves in a dishonest or unethical way.,,,without scruples or principles,,,,,,,
220,juncture,the shape or manner in which things come together,"A juncture is a crucial point in time when a decision must be made. At this juncture, a president might say, the government must decide whether to go ahead with war or to try to solve things diplomatically.",,a crisis situation or point in time when a critical decision must be made,,,,,,,,
,,,,,the shape or manner in which things come together and a connection is made,,,,,,,,
,,,,,an event that occurs at a critical time,,,,,,,,
221,fathom,a linear unit of measurement for water depth,"To fathom something is to understand it thoroughly. It's usually used in the negative, as in ""I can't fathom why he doesn't want to go along with us.""",come to understand,(mining) a unit of volume (equal to 6 cubic feet) used in measuring bodies of ore,,,,,,,,
,,,,measure the depth of (a body of water) with a sounding line,a linear unit of measurement (equal to 6 feet) for water depth,,,,,,,,
222,diligent,quietly and steadily persevering in detail or exactness,"Someone who is diligent works hard and carefully. If you want to write the epic history of your family, you'll have to be very diligent in tracking down and interviewing all of your relatives.",,,characterized by care and perseverance in carrying out tasks,,,,,,,
,,,,,,quietly and steadily persevering especially in detail or exactness,,,,,,,
223,ignominious,deserving or bringing disgrace or shame,"Losing a football game stinks, but losing a game where, at the end, you are lying face down in a puddle of mud and the fans are burning effigies of you in the streets? That is an ignominious defeat.",,,(used of conduct or character) deserving or bringing disgrace or shame,,,,,,,
224,galore,existing in abundance,"At a party with more cupcakes than anyone could imagine, you’ll hear guests say, “There are cupcakes galore!”  Galore means there’s so much that it’s unbelievable.",,,in great numbers,,,,,,,
,,,,,,existing in abundance,,,,,,,
225,imbibe,take in liquids,"Imbibe is a fancy word for ""drink.""  If you need to imbibe ten cups of coffee just to get out of the house, you might have a caffeine problem.",receive into the mind and retain,,,,,,,,,
,,,,take in liquids,,,,,,,,,
,,,,"take (gas, light or heat) into a solution",,,,,,,,,
,,,,"take in, also metaphorically",,,,,,,,,
226,succinctly,with concise and precise brevity; to the point,"To say something succinctly is to say it briefly, fitting your points into one concise statement. It's a talent rarely enjoyed and much appreciated.  You succinctly stated your case and sat down to great applause, not to mention great relief.",,,,,with concise and precise brevity; to the point,,,,,
227,tandem,an arrangement of objects or persons one behind another,"Tandem describes an arrangement where people or animals are in formation, one behind the other. Couples attached at the hip sometimes like to ride tandem bicycles, which allow two people to pedal the same bike. How cute.",,a bicycle with two sets of pedals and two seats,,,one behind the other,,,,,
228,unbridled,not restrained or controlled,"Unbridled means unrestrained. When you find out that you just won the lottery, feel free to jump up and down with unbridled joy. Go ahead, most people would probably let loose in the same way.",,,not restrained or controlled,,,,,,,
229,maudlin,very sentimental or emotional,"You can use maudlin to describe something that brings tears to your eyes, or makes you feel very emotional. Tearjerkers like ""Forrest Gump"" and ""Titanic"" can be described as maudlin.",,,effusively or insincerely emotional,,,,,,,
230,wheedle,"influence or urge by gentle urging, caressing, or flattering","To wheedle is to sweet talk, or flatter someone in the hopes of getting something in return. You might try to wheedle a meter maid into not giving you a parking ticket. Good luck with that.","influence or urge by gentle urging, caressing, or flattering",,,,,,,,,
231,amelioration,the act of relieving ills and changing for the better,Amelioration is a process that makes something better. A philanthropist might devote her life to the amelioration of poverty and hunger.,,the act of relieving ills and changing for the better,,,,,,,,
